{
  "request_version": "1.0",
  "output": {
    "format": "html",
    "theme": "auto",
    "container_id": "chart-root",
    "width": 1280,
    "height": 760
  },
  "chart": {
    "type": "bar",
    "title": "{species} {from_year}-{to_year} Survey by Year",
    "show_legend": true,
    "show_grid": true,
    "x_axis_label": "Year",
    "y_axis_label": "Abundance",
    "stacked": true,
    "grid_style": {
      "color": "rgba(24,79,63,0.15)",
      "width": 1
    },
    "show_data_labels": false,
    "legend_position": "top",
    "animation_duration": 750,
    "y_axis_min": 0
  },
  "data_source": {
    "proc_schema": "ri",
    "proc_name": "FWPSpeciesCountByYear",
    "endpoint": "http://localhost:3000/api/stored-proc",
    "http_method": "GET",
    "proc_params": {
      "from_year": "2024",
      "to_year": "2026"
    },
    "result_set_index": 0
  },
  "mapping": {
    "categoryField": "year",
    "valueField": "abundance",
    "groupField": "species"
  },
  "options": {
    "stacked": true,
    "indexAxis": "x",
    "border_radius": 4
  },
  "appearance": {
    "page_background": "linear-gradient(145deg, softmintlight, softmint)",
    "card_background": "cardlight",
    "title_color": "forestdark",
    "text_color": "forestsoft",
    "grid_color": "rgba(24,79,63,0.2)",
    "x_axis_label_color": "forestdark",
    "x_axis_value_color": "forestsoft",
    "y_axis_label_color": "forestdark",
    "y_axis_value_color": "forestsoft",
    "legend_text_color": "forestdark",
    "series_colors": ["chartblue", "chartorange", "chartgreen", "chartmauve"]
  }
}
