{
  "request_version": "1.0",
  "output": {
    "format": "html",
    "theme": "auto",
    "container_id": "chart-root",
    "width": 1100,
    "height": 680
  },
  "chart": {
    "type": "pie",
    "title": "{species} {from_year}-{to_year} Abundance Share",
    "show_legend": true,
    "show_data_labels": false,
    "legend_position": "right",
    "animation_duration": 750,
    "x_axis_label": "",
    "y_axis_label": ""
  },
  "data_source": {
    "proc_schema": "ri",
    "proc_name": "FWPSpeciesCountByYear",
    "endpoint": "http://localhost:3000/api/stored-proc",
    "http_method": "GET",
    "proc_params": {
      "from_year": "2024",
      "to_year": "2026"
    },
    "result_set_index": 0
  },
  "mapping": {
    "categoryField": "species",
    "valueField": "abundance",
    "labelTemplate": "{species} {year}"
  },
  "options": {
    "plugins": {
      "legend": {
        "position": "right"
      }
    }
  },
  "appearance": {
    "page_background": "linear-gradient(145deg, softmintlight, softmint)",
    "card_background": "cardlight",
    "title_color": "forestdark",
    "text_color": "forestsoft",
    "grid_color": "rgba(24,79,63,0.2)",
    "x_axis_label_color": "forestdark",
    "x_axis_value_color": "forestsoft",
    "y_axis_label_color": "forestdark",
    "y_axis_value_color": "forestsoft",
    "legend_text_color": "forestdark",
    "series_colors": ["chartblue", "chartorange", "chartgreen", "chartmauve"]
  }
}
