{
  "request_version": "1.0",
  "output": {
    "format": "html",
    "theme": "auto",
    "container_id": "chart-root",
    "width": 1280,
    "height": 760
  },
  "chart": {
    "type": "scatter",
    "title": "{species} {year} Length vs Weight {section}",
    "show_legend": true,
    "show_grid": true,
    "x_axis_label": "Length (mm)",
    "y_axis_label": "Weight (g)",
    "grid_style": {
      "color": "rgba(24,79,63,0.15)",
      "width": 1
    },
    "show_data_labels": false,
    "legend_position": "top",
    "animation_duration": 750
  },
  "data_source": {
    "proc_schema": "ri",
    "proc_name": "FWPSectionSpeciesLengthWeightScatterByYear",
    "endpoint": "http://localhost:3000/api/stored-proc",
    "http_method": "GET",
    "proc_params": {
      "year": 2026,
      "section": "Bighorn Section (Upper)",
      "species": "RB"
    },
    "result_set_index": 0
  },
  "mapping": {
    "xField": "length",
    "yField": "weight"
  },
  "options": {
    "pointRadius": 3,
    "point_style": "circle"
  },
  "appearance": {
    "page_background": "linear-gradient(145deg, softmintlight, softmint)",
    "card_background": "cardlight",
    "title_color": "forestdark",
    "text_color": "forestsoft",
    "grid_color": "rgba(24,79,63,0.2)",
    "x_axis_label_color": "forestdark",
    "x_axis_value_color": "forestsoft",
    "y_axis_label_color": "forestdark",
    "y_axis_value_color": "forestsoft",
    "legend_text_color": "forestdark",
    "series_colors": ["chartblue", "chartorange", "chartgreen"]
  }
}
